{
  "branch": "cp-pressure-test-2",
  "head_sha": "7c0afd6b5491430c740c35a72ed7582ed17149c2",
  "timestamp": "2026-02-01T20:56:11+08:00",
  "commands": {
    "test": { "status": "pass", "duration": "465ms" }
  },
  "gates": {
    "prd": { "status": "pass", "file": ".gate-prd-passed" },
    "dod": { "status": "pass", "file": ".gate-dod-passed" },
    "audit": { "status": "pass", "file": "docs/AUDIT-REPORT.md" },
    "test": { "status": "pass", "file": ".gate-test-passed" }
  },
  "env": {
    "node": "v20.20.0",
    "platform": "Linux"
  }
}
